proj_desc,desc_senti_score,desc_sub_score
jrip object strengthen capac judici sector profession institut formul implement chang ensur judici continu evolv effect institut abl meet need citizen protect right provid prompt fair adjud disagr,0.492857143,0.717857143
human institut develop program hidp object improv perform institut consid futur macedonia context usaid strategi hidp develop capac establish start institut conduct perform assess implement seri perform improv solut hidp provid train usaid local partner conduct academ program strengthen emerg leader creat intervent address specif technic area local partner organ give small grant ensur project alumni succeed carri action plan develop train program provid direct technic assist state commiss prevent corrupt scpc,-0.078571429,0.285714286
macedonia project assist develop effect respons account local govern continu local govern reform project provid technic assist area govern republ macedonia associ unit local govern zel local govern area activ includ polici assist central govern fiscal educ polici institut support associ municip zel associ commun enterpris adkom capac build municip area financ budget administr urban plan permit local econom develop citizen particip implement small project contract fund municip good govern fund mggf,0.05,0.138888889
court strengthen modern project work macedonian judiciari commun increas judiciari overal capac focu court practic perform transpar account project formul implement chang current framework law better enabl independ judiciari work develop implement proactiv case manag practic includ backlog reduct capac court administr manag judiciari increas court presid judg court administr train project increas capac exist legal train institut pilot basi introduc improv exist level autom computer,0.225,0.35
purpos project reduc corrupt madagascar strengthen capac malagasi govern anticorrupt institut mobil civil societi improv public awar engag overal fight corrupt project character comprehens focu strengthen complementari forc fight corrupt civil societi govern,-0.375,0.766666667
project focu tackl corrupt countri improv account transpar govern institut strengthen govern institut activ focu empow media civil societi demand corrupt free servic govern,-0.2,0.933333333
project seek improv effici account transpar local govern engag civil societi organ local govern develop expand media coverag local govern project help implement improv financi manag system procedur fiscal plan budget framework expenditur control procur procedur account audit practic sustain develop polici task help promot social cohes sustain develop local level integr inform technolog commun life,0.006666667,0.013333333
purpos moldova rapid govern support program mrgsp support wide rang govern reform moldova includ design implement etransform strategi govern moldova support design reform judici administr support agenc payment intervent agricultur support design system custom servic strengthen govern institut fiscal,-0.1,0.4
mexico greater transpar account govern program focu central aspect good govern transpar access public inform sound manag public financ,0.266666667,0.313888889
mexico justic secur program work primari object promot legisl framework crimin justic reform strengthen institut human capac implement crimin justic reform empow civil societi organ foster crimin justic reform,0,0.1
busi regulatori invest trade environ program brite aim engag enabl empow govern privat sector civil societi design implement reform reduc cost risk busi moldova project aim improv administr reduc administr burden pay tax term time cost file increas revenu collect streamlin busi process reduc administr burden complianc govern regul increas transpar reduc time cost move good border identifi support implement high impact regulatori reform improv busi environ overal,0.43,0.57
usaid rule institut strengthen program rolisp aim strengthen institut capac transpar account justic sector institut order bolster independ effect profession judiciari reduc opportun corrupt particular activ conduct rolisp lead effect transpar account moldovan judiciari strengthen capac superior council magistraci depart judici administr improv profession judici prosecutori cadr enhanc institut oper capac nation institut justic improv public legal awar increas capac civil societi organ monitor advoc judici sector reform,0.113333333,0.5
local govern support project lgsp seek assist moldovan local govern design implement polici procedur contribut good govern develop capac meet decentr author servic transpar manner provid basic servic engend growth local economi servic cost effect effici,0.14,0.145
moldova busi administr reform project biztar object support govern moldova effort encourag product invest improv busi environ lower overal burden state regul privat enterpris project focu streamlin busi state interact regulatori reform promot effici administr procedur ensur report requir busi purpos keep minimum need effect govern oper plan reduc regulatori administr burden privat enterpris streamlin administr curtail opportun corrupt improv access citizen busi govern inform,-0.5,1
project design improv govern moldova nation govern institut includ ministri health ministri justic judiciari state servic overarch goal program reduc corrupt sector corrupt identifi millennium challeng corpor countri threshold plan indic constraint moldova elig millennium challeng account,-0.5,1
program support govern mongolia effort acceler polici liber process promot increas competit economi achiev broad sustain privat sector econom growth project work citizen equip particip dialogu econom issu govern agenc improv commun open public,0.020833333,0.293055556
busi plu initi project design support enhanc role privat sector mongolia econom growth complement support govern mongolia strategi advanc follow object improv implement busi enabl polici strengthen privat sector capac competit increas financi sector capac enabl environ,0,0
project object build capac civic organ educ mobil voter leverag mobil commun technolog engag voter share inform campaign enhanc public particip polit process elect cycl particular women youth,0.322222222,0.433333333
overal object project judici transpar independ account program focu improv court administr case manag enhanc transpar effici court provid technic assist train equip focu case manag court assist legal educ legal ethic,0.2,0.2
goal stage project strengthen democrat govern build transpar account regulatori legisl environ ensur principl check balanc stage support govern mongolia bolster anti corrupt effort improv administr reform stage seek strengthen legal polici framework good govern administr reform empow anti corrupt agenc fulfil mandat increas privat sector engag anticorrupt effort improv capac civil societi monitor anti corrupt effort public privat sector enhanc account transpar procedur clariti pilot administr agenc encourag innov reform initi increas support awar anti corrupt administr reform program build previou mongolia anti corrupt support mac program implement usaid fund,-0.2,0.733333333
corrupt assess studi montenegro base anticorrupt assess framework actor institut delin strength weak countri system initi identifi obstacl opportun reform offer strateg programmat recommend base sound analysi need opportun constraint,-0.415,0.805
train advocaci network project goal strengthen rural civil societi institut region aimag enabl build effect relationship govern bodi expand improv servic commun form network cso strengthen advocaci outreach activ,0,0
project goal reduc deter corrupt mongolia improv legal framework increas public awar strengthen govern capac combat corrupt project seek strengthen capac independ author corrupt iaac prevent corrupt strengthen capac prosecut adjud corrupt case improv interag coordin combat corrupt increas citizen engag prevent corrupt,-0.366666667,0.807407407
goal appeal project promot democrat reform econom growth improv legal institut administr process target government agenc primari object project strengthen awar understand relev legal framework relat anti corrupt good govern support engag inform action local anim good govern mongolia legal framework local orient appeal project counterpart coordin center focu stage project,0.15,0.3
overal object good govern activ montenegro ggam project help develop transpar function respons govern institut strengthen role civil societi privat sector counterpart institut montenegro project distinct interdepend compon reform busi regul licens strengthen civil societi oversight anti corrupt effort improv judici administr transpar ggam work strengthen public trust public administr court civil societi oversight activ investig journal,0.1,0.406666667
gener purpos justic reform project develop rule montenegro specif project support govern montenegro effort reform modern framework law affect oper judici implement structur chang judiciari mandat reform legisl improv oper court introduct modern case manag court administr practic procedur project assist effort increas suppli essenti equip materi montenegrin court,0.2,0.3
build achiev implement emphas provid youth women opportun particip local affair strengthen capac govern mobil revenu develop innov partnership deliv local servic local govern hope improv perform develop way better mobil local revenu establish standard procedur intern control mechan transpar manag promot public privat partnership intermunicip collabor effect provis local servic,0.0625,0.070833333
morocco econom competit project aim reduc barrier trade invest support legal regulatori reform seek improv busi climat morocco aim valor water resourc increas product competit employ agricultur sector support develop workforc need competit economi,0.2,0.2
program morocco support govern respons need busi busi effect contribut morocco goal expand econom growth creation ultim goal easier busi morocco regulatori reform invest promot legal reform improv commerci disput resolut,0.2,0.2
goal program promot democraci good govern transpar account equit govern institut nation subnat level project task build capac region audit court effect carri audit accord intern norm inspector gener ministri financ conduct intern audit develop implement leadership train program local elect offici implement participatori strateg plan process citi provinc region design implement nation integr plan budget enabl access long term financ citi region strengthen civil societi particip slum upgrad initi citi neighborhood,0.3625,0.475
morocco parliamentari support project support improv facet moroccan parliament work aim increas capac member parliament project design strengthen parliamentari committe develop special budget expertis parliament strengthen advocaci effort parliament,0.357142857,0.571428571
assess corrupt morocco,-0.5,1
make govern increasingli democrat mgid project mozambiqu aim capit opportun creat municip framework demonstr potenti democrat local govern partner municip nacala monapo guru_ chimoio vilankulo purpos ultim provid short long term technic assist train commod procur select municip order improv democrat govern process accomplish follow categori intervent implement local level citizen particip mechan develop municip plan manag capac strengthen municip revenu gener servic deliveri capac establish local level anti corrupt mechan dissemin best practic exist network,0.064285714,0.285714286
project support transit democraci commun outreach target youth margin group infrastructur commun train grant design spread awar elector process increas local engag particip peac process project strive improv effect polit institut expand access inform diversifi public debat issu critic transit,0,0.033333333
strengthen rule respect human right project nepal rule anticorrupt project purpos project help nepal address import system legal institut impedi meaning reform project seek enhanc qualiti government civil societi initi reform modern nepali justic strengthen nation capac combat corrupt rule activ project includ strengthen defens represent strengthen administr manag capac judiciari support judici institut judici academi judg societi judici council provid effect mechan enforc judici decis develop court relat altern disput resolut anticorrupt activ includ promot broadli base corrupt awar prevent campaign especi nongovernment sector strengthen institut capac commiss investig abus author special anticorrupt court offic attorney gener nation vigil center,-0.095238095,0.534126984
nepal govern citizen partnership project ngcpp design help govern nepal reestablish legitim effect secur govern combat potenti fractur nepal ngcpp effort introduc integr packag secur govern develop assist target local level terai region initi creat provid support local govern local level peac initi transpar inclus develop plan level core object ngcpp support strengthen govern restor citizen confid public institut implement quick impact activ ensur public reap peac dividend encourag creation assist reintegr ensur margin popul feel connect nation level peac process,0.055555556,0.105555556
nicaragua anti corrupt transpar account program aim enhanc govern capac promot transpar account aim increas manag transpar account target municip enabl particip strengthen civil societi capabl includ media busi sector seek increas polit account,-0.5,1
organiz develop nicaraguan civil societi program aim promot increas organiz capac stronger govern structur oper effici strateg vision select civil societi organ nicaragua program provid ongo profession support follow area govern leadership strateg plan manag structur practic market commun strateg realign collabor,0,0
object nicaragua human institut capac develop program hicd address core factor greatli impact sector capac perform environ sustain hicd seek achiev improv perform understand gap barrier organ ultim goal hicd improv local institut perform critic area lead measur result achiev organ goal object,0,0.05
nicaragua media program cross cut project design support countri effort improv democraci govern econom growth health educ environ program work independ mass media organ convey inform supplement strengthen democraci develop health messag assist program wide array target audienc media assist nation region level design radio televis show print journal commun program state interact technolog,-0.05,0.2
restructur econom framework open reform macroeconom stabil reform program aim improv polici environ address major impedi econom growth nigeria program compon includ budgetari process procur oversight capac build govern nigeria institut civil societi organ cso involv polici process implement polici reform sector,0.03125,0.5
project design build capac judici actor institut investig manag resolv corrupt case crimin procedur code task strengthen judici capac address corrupt work civil societi organ educ public monitor project object increas capac judici lima callao peruvian amazon region resolv corrupt case increas capac judiciari address intern corrupt strengthen judici capac address corrupt effect civil societi engag,-0.416666667,0.844444444
democraci govern assess nigeria aim examin posit neg trend countri avenu continu support encourag develop democraci work trend revers progress crack polit stranglehold oligarch continu widen public particip need channel legitim democrat institut open polit space simultan exacerb exist social fissur time critic propon support nigerian democraci help provid environ polit reform root grow,0.011111111,0.211111111
sustain practic agricultur critic environ space nigeria work commun institut cross river state help safeguard divers global signific natur heritag,0,0
object lead improv local govern work state local govern strengthen capac govern build better relat commun promot effect strengthen manag capac servic depart increas transpar local govern oper participatori budget process base sound analysi servic revenu potenti strengthen capac state govern monitor budget expenditur promot greater transpar local govern bring mandat fiscal respons public procur law local govern level strengthen organiz servic capac broad rang organ state local level servic plan budget monitor servic improv health educ collabor focu state project support local govern select servic water sanit,0.050961538,0.213782051
overal goal program pakistan support condit stabil develop conflict prone prioriti area build confid trust govern pakistan commun develop construct commun identifi project support good govern encourag broad base commun particip decis make increas access public inform social econom polit activ polici program mean initi step support renew effort better deliv servic commun,0.026190476,0.461904762
overal goal project improv decentr manag effect servic deliveri benefit margin popul target region madr dio amazona loreto martin ucayali work differ sector level govern project improv polici implement reform directli impact nation govern strengthen nation institut effect public servic deliveri improv manag social conflict disast risk reduct enhanc govern account improv formal transpar mechan expand participatori process,0.016666667,0.066666667
program aim strengthen polit parti promot polit reform feder administ tribal area fata support elector process,0,0
program support democrat develop pakistan polit parti strengthen democrat govern civic particip program,0,0
object anti fraud hotlin ensur transpar prevent corrupt citizen cso encourag report corrupt regist complaint directli anti fraud hotlin websit,-0.433333333,0.733333333
pakistan trade project design focu har power intern trade engin sustain econom growth stabil pakistan target technic assist program support govern pakistan privat sector stakehold improv trade environ effect trade polici implement goal enhanc capac procedur system pakistan institut increas region trade especi pakistan border reduc time cost intern trade pakistan increas formal cross border trade trade project aim acceler pakistan integr global economi main compon program improv custom trade facilit improv transit trade enhanc trade transport facilit improv trade polici export promot enhanc econom zone regim focu area conflict vulner popul promot women trade gender mainstream dedic capac build,0.055555556,0.111111111
program goal assist govern privat sector civil societi actor work slow revers spread corrupt,-0.4,0.7
program seek reduc impun strengthen investig capabl public ministri capabl disciplinari judiciari intern govern control system civil societi particip govern oversight activ control gener offic project task support integr public registri inform legisl oversight public financ seek improv paraguay perform rule justli econom freedom indic,0,0.066666667
paraguay second threshold program focu anticorrupt effort enforc custom health care judici sector aim rais perform control corrupt rule indic object program reduc opportun corrupt increas success prosecut wrongdoer improv public opinion govern effort area reinforc paraguay commit combat corrupt,-0.2,0.511111111
program intent overal reduc contraband evas major sourc problem paraguay,0.0625,0.5
project goal strengthen intern control anti corrupt mechan ministri health provid inform technolog solut improv procur establish manag unit monitor storag distribut system improv suppli drug project seek improv essenti health commod suppli chain strengthen logist manag inform system streamlin distribut system identifi financi resourc procur suppli chain oper enhanc forecast procur plan project encourag policymak donor support logist critic factor overal success health care mandat,-0.1,0.5
purpos project reduc corrupt public administr activ develop govern peru approv millennium challeng corpor activ aim reduc corrupt foster greater citizen awar strengthen govern intern control sanction mechan improv govern procedur process allow corrupt flourish,-0.2,0.713333333
corrupt assess rwandan health sector focu analyz corrupt vulner corrupt practic health sector area procur warehous stock distribut drug medic equip recruit personnel relat deal public financi materi human resourc manag function mutuel commun base health insur cbhi commun health worker citizen particip oversight,-0.383333333,0.694444444
object prod support effort peruvian govern process improv public polici regulatori framework strengthen capac subnat govern nation level project seek provid technic assist critic legal reform matter implement regul procedur public polici nation level project task build local region govern capac govern effect includ reinforc good govern practic participatori budget plan improv implement nation public invest procur process state contract result base budget improv effici select municip govern includ administr simplif result base budget promot local econom develop implement innov strategi collect local level support municip associ inter region coordin board format public privat allianc,-0.063636364,0.278787879
overal object prodec increas respons nation elect govern citizen local level select region encourag practic participatori local govern program seek contribut strengthen democrat govern promot good govern practic enhanc capabl public institut civil societi organ contribut effect process core program focu develop consolid capabl stakehold public offici staff civil societi assum function decentr govern nation region local level,0.214285714,0.233333333
purpos rule effect role project provid technic assist support govern philippin anti corrupt anti money launder activ justic reform view foster sustain econom growth enhanc competit philippin economi encourag intern domest invest improv busi climat enhanc rule expect result increas public awar level corrupt effect result increas support particip anti corrupt activ strengthen capac effect anti corrupt enforc institut implement prophylact anti corrupt initi vulner govern institut civil servic increas abil govern republ philippin combat money launder seek mediat court appeal suprem court refin dissemin caseflow manag continu train judg law pass,-0.416666667,0.844444444
project goal reduc opportun corrupt improv revenu administr provid technic assist agenc program task support enforc effort agenc corrupt evas smuggl train investig prosecutor surveil equip work flow engin research case analys,-0.5,1
project aim increas awar central nation budget govern account deepen capac civil societi undertak budget monitor tool account prompt govern respond monitor advocaci accept recommend act concern rais stakehold nation budget better substant polici choic budget process transpar,0.25,0.375
project design assist ombudsman depart justic develop monitor progress corrupt case project provid technic assist constitut integr group compos ombudsman civil servic commiss commiss audit effect corrupt detect deterr environ project support applic corrupt diagnost select local govern unit,-0.375,0.75
project build counter corrupt advocaci promot transpar account mindanao acceler develop spread improv practic local govern project target strengthen civil societi privat sector constitu counter corrupt reform support philippin nation local effort implement good govern promot econom growth poverti reduct,-0.06,0.52
enhanc govern anticorrupt effort philippin aim achiev twin goal assist ombudsman advanc legisl agenda increas effect anticorrupt enforc promot media citizen report corrupt good govern public websit strateg effort seek cultiv cultur account transpar public confid cooper,0.05,0.433333333
launch deepen technic assist mindanao local govern greater fiscal respons transpar account servic deliveri enhanc project aim bring nation conscious local govern issu need nation action design strengthen local govern linkag capac polici reform data gener inform share dialogu project work improv qualiti local govern sustain econom growth peac mindanao,0.1,0.157142857
goal broader bilater engag shift philippin growth path higher sustain inclus growth high perform emerg economi project intend contribut higher growth reduc cost corrupt invest trade promot open fair competit fulfil goal pursu follow desir result effect consist time prosecut larg scale corrupt case improv legal tool detect investig prosecut corrupt strengthen account anticorrupt offic includ greater transpar prosecut effort intensifi effort prevent corrupt improv corpor govern public privat corpor greater busi sector contribut anticorrupt effort,0.043076923,0.631282051
philippin environment govern ecogov project work govern republ philippin depart environ natur resourc denr provid technic assist implement activ result improv environment govern project local nation counterpart improv manag forest coastal area solid wast promot local govern invest sanit facil,0,0.033333333
project work modern procur audit practic strengthen investig prosecut enhanc capac civil societi demand greater transpar account,0.35,0.4
provid technic assist augment effort philippin liber partner stakehold project seek improv countri econom polici environ chang polici regul industri govern practic industri relat project technic assist focu polici formul implement relat trade invest fiscal reform essenti acceler sustain growth goal activ enhanc philippin competit structur increas invest opportun improv inter intra sector effici boost busi effici,0,0
project aim strengthen local govern mechan econom develop mindanao relat corrupt project aim improv overal busi environ increas competit citi better govern project provid model good govern tool practic,0.175,0.525
