proj_desc,desc_senti_score,desc_sub_score
program specif goal assist implement accusatori trial increas number avail skill colombia public defend help reform administr manag judici transpar effici equit increas access justic poor disenfranchis improv qualiti increas avail altern disput resolut servic assist establish justic hous colombia increas capac civil societi mobil support justic reform monitor assess advoc assist nation justic reform process,-0.2,0.333333333
program intend improv protect human right access justic cambodia origin design primarili provid support human right ngo scope program expand includ support legal judici reform cooper govern institut program overal improv abil cambodian stakehold government government undertak effect advocaci educ train effort ensur justic human right properli observ uphold,0.151020408,0.301020408
public legal advocaci program pilap goal legal assert protect citizen right encourag government privat sector transpar account pilap select legal case strong potenti gener public debat demand broader account respect legal norm mere bound case protect individu client right pilap hop demonstr legal viabil instrument gener greater transpar respect rule pilap seek assist citizen govern better understand right oblig citizen develop confid legal right respect govern demonstr commit respect rule,0.204761905,0.356845238
program right justic cambodia praj focu human right advocaci rule promot biodivers protect build success year program right justic cambodia praj project continu work promot access justic improv profession standard futur cambodian legal commun strengthen grassroot advocaci commun network includ commun base advocaci protect cambodia biodivers initi praj includ activ improv collect justic data develop institut capac ministri justic improv court administr case manag select court,0.069642857,0.363392857
better health servic program cambodia work ministri health increas demand equit access qualiti health servic project aim build capac public privat servic deliveri system expand model health financ improv qualiti impact matern neonat child health servic strengthen control infecti diseas build health system strengthen cambodia project manag,0.25,0.283333333
engag labor issu cross sector integr legal polit econom dimens improv efficaci strateg approach program program cambodia emphas good health good educ good polit econom govern expect futur focu busi enabl environ issu focu provid platform help assur cambodia labor enabl environ strengthen corrupt present ongo challeng cambodia consider traction fight corrupt gain public privat sector pursu anti corrupt measur labor sector empow labor civil societi organ fight corrupt directli neg affect member interest respect rule pillar promot democraci good govern cambodia promot requir promot substant human civil right includ labor right respect procedur justic establish rule procedur fairli transpar consist appli sound institut,0.123214286,0.514880952
goal project support region govern stabil effort rais legitimaci state presenc build local capac implement good govern increas citizen particip plan deliveri public servic,0.233333333,0.222222222
program object strengthen justic servic colombia ensur access legal servic improv access justic reduc impun especi peopl live rural margin region colombia affect violenc,0.112121212,0.233333333
object program provid technic support train improv manageri capac local govern effect manag royalti increas citizen particip overse develop social infrastructur vulner popul accord law regul program work municip guajira cordoba meta,0.016666667,0.033333333
build recoveri democrat govern advanc consolid transit program brdg program aim strengthen institut capac independ elector commiss polit administr justic commiss nation assembl program aim provid emerg logist assist economi financ commiss nation assembl emerg logist assist provinci assembl district,0,0
project combin integr area activ rule anticorrupt rule compon focu assist justic earn confid citizen deliv independ effect ethic justic administ imparti highli qualifi justic profession anticorrupt compon serv strengthen public sector institut help discov investig prosecut corrupt case anticorrupt compon draw close summer rule compon extend spring,-0.25,0.533333333
main object program develop access empow justic improv judici manag lower cost access justic inform engag public projustic design main compon correspond core object support establish judici institut effect transpar manag judiciari ministri justic effect transpar access court oper pilot jurisdict increas access justic vulner popul,0.111111111,0.244444444
major object program enhanc transpar oversight contribut govern effect polit stabil djibouti specif program goal dacp twofold assist offic inspector gener parliament djibouti provid technic assist train support promot good govern transpar public sector function elimin precondit corrupt increas public awar govern fight corrupt public servic announc psa,-0.033928571,0.471428571
dominican republ transpar citizen action program aim reduc corrupt help dominican combat corrupt practic chang attitud consequ corrupt enabl wide chang prevent reduc corrupt goal achiev increas citizen awar corrupt issu mass media campaign help build network local nongovernment organ ngo work corrupt strengthen citizen oversight govern activ develop media grant facilit coverag corrupt issu strengthen govern abil respond corrupt track corrupt complaint train prosecutor judg demonstr project passport custom agenc,-0.369230769,0.746153846
dominican republ transpar account project aim improv access public inform public procur process intern control system project work increas access public inform ensur freedom inform offic offic suffici polit budgetari support aim improv transpar competit govern procur assist nation offic procur comptrol gener target line ministri follow promot transpar bid award procedur project aim increas govern horizont account control corrupt strengthen check balanc institut goal achiev uniform approach strengthen inter institut commun cooper standard guidelin perform mean ultim reduc incid corrupt,-0.1875,0.4125
project aim increas effect transpar fair dominican crimin justic,0.7,0.9
project object improv access public inform public procur process intern control system project work increas access public inform ensur freedom inform offic offic suffici polit budgetari support,0,0.066666667
project object improv judiciari technic manag capac process critic case project help establish mechan strengthen intern extern oversight justic sector reform oper design implement activ enhanc independ imparti justic institut particularli judiciari public ministri promot coordin justic sector actor project manag grant local support sustain commun justic hous,0,0.033333333
task project includ track anticorrupt legisl support media activ rais citizen awar corrupt issu publish transpar index public institut sponsor workshop seminar,-0.25,0.533333333
desk studi task review anti traffic program east asia pacif region,0,0
timor lest threshold program aim reduc corrupt build network function effect anti corrupt institut actor aim support anti corrupt commiss lead agenc anti corrupt educ prevent investig build offic prosecutor gener investig prosecutori skill particularli corrupt case econom crime aim strengthen audit capabl intern govern audit entiti establish extern audit author improv govern timor lest abil prevent detect instanc corrupt strengthen parliament role increas oversight govern fiscal manag practic furthermor program aim improv access immun servic creat capabl effect commun health main goal strengthen servic deliveri identif unimmun children identifi underserv area develop long term solut improv maintain higher coverag rat immun chronic coverag area integr commun health servic unit sisca function healthcar servic unit project support district,-0.292592593,0.803703704
report analyz statu corrupt anticorrupt program timor lest focu particular vulner corrupt abus offer prioriti program option usaid govern donor government organ consid subsequ year,-0.277777778,0.777777778
support local govern elect civil societi timor lest program goal enhanc capac newli elect suco council strengthen citizen particip villag municip govern program focu strengthen capac suco council municip oecuss bobonaro ainaro baucau strengthen citizen particip villag municip govern,0.533333333,0.6
project anticorrupt element focu provid profession advic assist anticorrupt commission project support rang strateg advic plan start administr support train investig train intern exposur procur deliveri custom manag inform project aim inform popul judici public role anticorrupt effort,0,0.066666667
democrat reform support program drsp aim support lead advoc democrat reform public privat sector civil societi advanc safeguard democrat reform includ rule freedom inform justic sector reform free fair elect drsp support develop framework directli elect local govern head provid technic assist govern agenc improv legisl support effort fight local level corrupt support effort implement special autonomi aceh papua,0.284126984,0.570899471
nation multi disciplinari assess team spend week conduct open end interview relev actor state local level includ villag elder suco leader repres govern ministri media outlet religi organ civil societi myriad nongovernment organ addit interview repres unit nation mission timor lest unmit intern agenc mission base dili team member travel suai nearbi border indonesia baucau timor lest assess team member identifi arch factor breakdown imped progress rule devis recommend address breakdown,-0.266666667,0.5
program aim build independ judici perform monitor civil societi organ media project support legal advocaci campaign facilit collabor government institut civil societi aim establish compet access legal servic disput resolut mechan commun level strengthen capac resist administr corrupt final project aim increas transpar judici process inform citizen access justic particularli margin popul,-0.025,0.6
program combat corrupt improv transpar account democrat institut increas oversight capac civil societi increas polici consensu democraci area project object directli support strateg object increas citizen support democraci measur level citizen percept corrupt,-0.5,1
democrat local govern project ddlgp ecuador aim strengthen democrat local govern oper ecuadorian municip ecuador ddlgp know project democraci develop ddlgp integr compon municip strengthen technic train stakehold particip citizen particip focu mechan citizen particip local govern decis make help ensur resourc project direct solv prioriti concern commun polici reform support transfer author subnat govern unit legal regulatori reform coordin polici reform initi,0.06,0.12
justic sector reform program jsrp indonesia respons ensur achiev program object develop effect transpar account independ judici branch govern assist implement roadmap reform public prosecut addit grant conduct indonesia corrupt percept index survey public awar campaign corrupt level indonesia survey aim measur corrupt level citi indonesia,-0.3,0.626666667
purpos municip strengthen project promuni ecuador provid technic expertis municip govern primarili promot effect account govern local level formal citizen particip decis make oversight process promuni primari object increas local govern capac public manag municip addit program enhanc public particip includ citizen strateg plan process foster transpar improv access inform,0,0.033333333
program build previou reform egypt competit project provid technic assist enhanc egypt compet regulatori reform streamlin busi process improv labor skill product modern financi sector project support egypt goal promot global competit educ innov human resourc base economi benefit egyptian equit focu broad product driver competit includ conduc regulatori reform streamlin busi process improv labor skill product strengthen financi sector,-0.1075,0.3425
local govern support program lgsp support expand participatori effect account govern integr assist activ engag local govern legisl council civil societi organ cso specif lgsp seek strengthen core compet local administr strateg participatori plan financ budget account manag system public servic deliveri seek strengthen demand democrat govern local level work local council civil societi media,0,0.011111111
water wastewat sector support program object promot sustain water sanit util technic assist train hold compani water wastewat oper subsidiari project aim build organ capac water product distribut wastewat collect treatment dispos relat capit improv project seek assist increas financi commerci viabil util develop implement capit invest plan program manag improv human resourc manag increas manageri technic oper effici improv servic qualiti,0,0.1
project goal solidifi reform develop clear implement approach achiev measur result provid technic servic relat resourc strengthen polici legal regulatori framework water wastewat develop implement reform support govern capac provid polici direct effect oversight sector strengthen activ includ develop strateg plan sector creat framework public privat partnership improv capit invest plan effort aim improv qualiti water wastewat servic extend benefit custom,0.1,0.2625
georgia busi climat reform gbcr project work georgian govern improv public manag streamlin servic busi public includ simplifi administr procedur project partner govern improv custom administr assist analysi draft amend implement commerci law improv busi regul,0,0.066666667
combat corrupt promot transpar program multi prong approach effort fight corrupt egypt involv promin egyptian expert repres busi associ civil societi organ multin corpor polit parti academ institut media outlet furthermor program work empow partner case democrat market orient reform advoc econom polici reform combat corrupt,-0.5,1
project aim review larg collect document recent histori current statu indonesian prior field work assess seri appli analyt framework develop dcha assess begin identifi salient featur indonesian context trace histor evolut countri allow appreci goal prompt govern engag reform section assess identifi deficit continu confront reform examin princip characterist democrat decentr local govern ddlg author autonomi account capac lead identif rang constraint address assist program section examin feasibl type reform util polit economi optic identifi actor interest condit perspect reform distinguish winner loser help gaug like support opposit path reform section delv institut arena process play nation subnat civil societi arena,0,0.1625
combat violenc women children project egypt work nation council women commiss grind break studi violenc women base recommend studi support develop nation strategi combat violenc women project support implement amend child particularli provis establish nation wide child protect network train child protect committe local bodi implement project provid grant fund technic assist train government organ provid legal servic vulner children,-0.175,0.4
administr crimin justic aocj project work egyptian govern improv administr crimin justic project help autom prosecutori file ensur complet case effici fairli process help strengthen provid appoint qualifi counsel repres defend project help train prosecutor right counsel human right issu,0.19047619,0.39047619
project object promot invest improv egypt financi structur servic support macroeconom stabil increas trade invest strengthen privat sector project seek reduc govern role deregul burdensom regim streamlin process harmon polici law regul govern econom institut task build capac individu institut necessari support implement reform assur polici process procedur implement adopt appropri sustain,0,0
goal build market infrastructur requir real estat financ form secur lend technic assist aim institut strengthen regulatori reform profession develop overal goal achiev technic assist develop real estat financ channel includ sound legal framework consist appli credit underwrit procedur access long term fund real estat activ support financi institut technic support improv legal institut process collater financ includ modern registr real properti introduc improv procedur record lien repossess collater support improv credit inform produc state cost collect retriev manag inform assist develop innov financi instrument seek broaden rang financi instrument mobil resourc product invest,0.194444444,0.3
project violenc impun pavi program aim strengthen prosecut crime improv manag coordin justic sector institut support merit base hire,-0.8,1
commerci develop program cldp work egypt year area trade insur judici reform competit invest consum protect intellectu properti standard work cldp staff develop close work relationship level egyptian offici steward econom critic infrastructur agenc transit relationship form basi continu institut capac build econom critic institut egyptian judiciari consum protect agenc egyptian organ standard,0,0
salvador democraci strengthen program main object continu effort support level salvadoran govern increas respons account citizen increas transpar govern ethic behavior public offici reduc condit corrupt public administr strengthen link citizen govern increas confid continu foster civil societi particip particularli privat sector promot transpar account control corrupt public fund,-0.138888889,0.422222222
salvador transpar govern program focu provid technic assist support govern salvador develop proper transpar account framework support civil societi organ media actor exercis proper oversight nation govern,0,0.1
project object implement crimin procedur code improv commun polic relat provid technic assist train improv scientif evid,0,0
fiscal polici expenditur manag program fpemp help govern increas revenu rais rat achiev greater transpar account effici public resourc program aim modern gener director intern revenu improv taxpay servic reduc fraud evas enhanc legitimaci project build foundat reform lay preced project call polici administr reform tpar,0.233333333,0.288888889
strengthen land administr program ethiopia focu reform legal framework land properti harmon region land administr law feder legisl aim improv awar land user stakehold land administr land law regul strengthen capac feder region govern implement second level land registr certif,0.1,0.1
judici independ legal empower project jilep aim strengthen judici independ strengthen institut capac legal profession associ improv qualiti legal educ develop commerci improv commerci relat practic jilep activ gear contribut judici independ transpar profession,0.2,0.2
good govern georgia project aim improv transpar institut effici prevent opportun corrupt level govern provid better servic citizen improv commun channel government institut civil societi nation level program promot improv public administr advanc public sector reform target institut human institut capac develop approach municip level program promot respons profession engag local govern project provid space civic engag citi georgia,0.1,0.333333333
judici administr manag reform jamr project aim promot independ strengthen capac georgia judiciari project combin integr area activ includ improv court oper establish court manag recogn effect specialist georgia judici strengthen capac judiciari develop manag court budget public outreach,0,0.066666667
ghana govern program logodep work western region district aim expand public particip local govern support target district increas fund gener intern hop achiev comprehens develop plan,0,0.022222222
consum provid health offici face multipl challeng need address improv health save live health system address challeng work health system strengthen element particular focu prioriti health issu aid tuberculosi malaria matern child health reproduct health varieti problem confront health system relat govern health system approach tackl demand work citizen oversight entiti insid outsid govern enhanc capac exercis voic suppli strengthen health sector actor govern problem confront health system vagu defin poorli understand rule institut exist global local level govern issu interconnect complex exampl corrupt deriv combin intern financ mechan local financi manag practic weak engag citizen health polici dialogu result lack capac civil societi limit incent capac ministri health moh share inform engag stakehold global project,-0.096885522,0.317592593
guatemala transpar anticorrupt program seek creat transpar system manag public resourc nation govern aim gener opportun citizen particip oversight nation govern decis make aim enhanc account elect appoint offici,0.4,0.483333333
program object establish transpar system manag public resourc local govern increas devolut resourc local level result greater respons local govern citizen need provid opportun citizen particip oversight local govern decis make build local capac develop implement reconstruct program strengthen marco depart,0.071428571,0.080952381
guatemala transpar integr project work govern guatemala civil societi organ improv transpar investig prosecut corrupt guatemala major compon project improv capac effect implement guatemala access inform,-0.21875,0.75
local govern project aim improv account confid democrat govern guatemala increas capac local govern provid municip servic promot econom develop increas particip inclus transpar decis make local level seek improv financi manag capac municip increas level sourc revenu select municip improv credit worthi capac select municip improv capac deliv basic servic municip improv environ econom develop work municip,0,0.03125
goal support nation budget transpar program develop anti corrupt framework polici transpar process form spend state budget aim assist state agenc civil societi form anti corrupt coalit,-0.5,1
project design identifi clarifi reinforc properti right land miner diamond mine pilot sit,0.285714286,0.535714286
program object drive govern guyana commit achiev maintain fiscal sustain effici effect regim effici public expenditur manag improv fiduciari oversight gtcp main goal reduct fiscal deficit number day start busi emphasi busi incorpor number day clear import custom goal achiev provid technic assist agenc order improv strengthen institut oper arrang transpar account fiduciari oversight public procur administr human resourc capac polici analysi computer streamlin busi process,0.053333333,0.19
guyana democrat consolid conflict resolut program aim promot citizen particip polici make foster transpar account improv justic reduc vulner ethnic polit conflict overal goal program increas citizen particip polici decis make capac build cso increas transpar govern build block develop polit consensu reduct conflict,0,0
program design improv polici legal framework increas capac local govern effect govern provid basic public servic enhanc transpar local govern citizen particip public inform,0.033333333,0.076388889
program promot establish practic transpar respons account local govern municip municip associ program dissemin best practic municip mancomunidad support civil societi initi propos improv municip govern manag servic provis promot continu transpar polit transit local govern improv capac nation govern entiti support regul local govern engag privat sector organ promot good govern ethic busi practic,0.34,0.18
rule strengthen program hondura design strengthen rule activ improv legal framework increas justic sector capac expand access justic tradit margin group decentr govern resourc author program seek support implement crimin procedur code establish independ apolit effect judiciari establish independ apolit effect public ministri broaden civil societi particip justic sector reform monitor chang mind rule court univers,0.1,0.133333333
hondura corrupt assess assess current situat numer sector includ educ health econom assess recommend strategi futur program,-0.25,0.7
financi crime prevent project fcpp design strengthen indonesia abil combat financi crime fcpp provid technic assist financi intellig unit ppatk suprem audit commiss attorney gener offic corrupt erad commiss ministri financ inspector gener offic fcpp work aid indonesia effort build modern legal institut framework detect prosecut corrupt financi crime separ agreement activ work central bank commerci bank know custom principl special train enhanc financi sector stabil sound support effort aim promot indonesian financi sector safeti sound lead increas invest growth creation,0.069642857,0.515178571
acc project aim assist suprem court govern indonesia implement blueprint develop commerci court establish anti corrupt court improv indonesia invest busi climat project consist technic assist expatri local advisor short term technic assist capac build infrastructur inform technolog support domest intern train type assist determin mutual agreement,-0.166666667,0.433333333
siap seek contribut good govern econom growth indonesia strengthen integr account govern agenc princip nation level support effort account agenc larg technic assist train corrupt erad commiss suprem audit bodi program support effort strengthen polit integr account reduc influenc money polit includ effort strengthen regul polit financ effect oversight enforc,0.1,0.8
project focu sustain deepen reform indonesian justic sector produc corrupt account highli perform justic goal seek achiev effici credibl transpar function suprem court attorney gener offic includ increas compet integr judg prosecutor staff integr meet goal compon project design meet special initi govern strengthen reform process indonesian justic sector,-0.071428571,0.785714286
