proj_desc,desc_senti_score,desc_sub_score
compon program seek exist improv implement way ensur progress achiev sustain long term project help govern islam republ afghanistan strengthen high offic oversight make strong effect institut abl lead monitor coordin report effort combat corrupt countri project work implement program institut develop sustain support offic carri prioriti asset registr verif complaint manag case track coordin monitor anticorrupt perform govern agenc,-0.051333333,0.574666667
overal goal program support rule strategi afghanistan specif pillar improv justic sector reduc corrupt pillar build leadership justic sector civil societi support pillar contractor attempt develop capac judiciari school pillar contractor work rais public awar encourag citizen resolv disput formal justic sector program divid compon capac build judiciari capac build court manag system capac build faculti sharia final public legal outreach awar strateg commun,-0.06,0.466666667
project focu strengthen improv tradit disput resolut mechan strengthen linkag formal inform justic sector develop approach address long stand intract disput,-0.05,0.4
polit parti assess team aim review materi produc report research academ think tank team interview individu involv afghan polit citi countri team afghanistan signific tradit democraci long stand past decad elector cycl recent express tradit hamper violenc corrupt local interpret islam discourag question cultur norm power structur prevent particip women polit,-0.16,0.38
justic sector strengthen project promot court transpar fair effici bolster watchdog anticorrupt role civil societi organ media strengthen legal profess legal educ albania project focu improv justic deliveri respond public demand account justic sector,0.275,0.341666667
kabul citi initi provid technic materi support kabul municip project work close partnership kabul mayor municip staff enhanc capac kabul municip administr manag function aim provid effect respons servic deliveri kabul municip depart offic improv long term sustain financi viabil kabul municip result activ kabul resid busi owner hope share renew confid local govern abil provid improv municip servic understand municip leader play activ role municip decis make process,-0.025,0.2
afghanistan parliamentari assist project apap work establish afghan parliament oper strong effect independ delib bodi project primari object design legisl strengthen strategi help establish develop strong independ effect parliament provid technic assist parliamentari committe strengthen parliament public outreach capac establish support parliamentari budget offic educ institut overal project advanc afghan parliament institut technic polit develop work member upper lower hous parliament staff leadership offic committe addit legisl support apap activ aim improv parliament constitu outreach effort commun inform technolog nation budget review,0.216666667,0.383333333
project aim includ assess rehabilit commun infrastructur basic vocat train train local govern offici cash work activ provis agricultur input equip project facilit engag commun govern offici afghan govern respons need extern organ,0,0.0625
object region afghan municip program urban popul ramp south creat effect respons democrat transpar account gender sensit municip govern target municip countri ramp south work increas capac govern islam republ afghanistan giroa municip offici improv deliveri municip servic citizen target municip increas municip capac enabl support sustain econom growth,0,0
region afghan municip program urban popul region command west ramp west project help govern islam republ afghanistan giroa establish capabl legitim govern municip level provinci capit isaf region command west herat farah chagcharan qala primari custom municip offici mayor revenu offic engin citizen benefit municip servic ramp west take learn approach help municip implement visibl servic deliveri improv project project municip offici improv capac deliv servic increas citizen satisfact trust support municip govern emb technic advisor municip staff provid necessari resourc build capac municip staff better perform core manag improv servic deliveri support econom develop ensur sound financi manag expand revenu enhanc transpar account,0.3,0.3
region afghan municip program urban popul region command east ramp east program support provinci capit primari custom municip offici mayor revenu offic engin citizen benefit municip servic ramp east aim help municip implement project local offici improv capac deliv servic build satisfact trust support citizen program put municip offici demonstr charg lead participatori plan process overse implement,0,0
region afghan municip program urban popul ramp north project address challeng help govern islam republ afghanistan giroa establish capabl legitim govern municip level provinci capit primari custom municip offici mayor revenu offic engin citizen benefit municip servic small scale sustain servic deliveri improv project municip implement aim improv capac deliv servic increas citizen satisfact trust support municip govern,-0.125,0.2
trade access facilit afghanistan tafa goal improv trade environ afghanistan specif focu cross border trade transit order foster increas invest export market base employ opportun accomplish tafa support govern islam republ afghanistan giroa privat sector main area trade polici liber custom reform trade facilit public outreach trade relat issu,-0.158333333,0.35
juli offic transit initi launch phase current program afghanistan support stabil reconstruct initi object afghanistan stabil initi address instabl foster strengthen condit build link govern islam republ afghanistan giroa local afghan commun close coordin intern secur assist forc isaf program increasingli support commun violenc prone area stabil project need march begin second phase current engag afghanistan commun cohes initi seek improv stabil area vulner insurg exploit order creat enabl environ sustain peac tradit develop program strengthen tie local actor customari govern structur giroa empow commun base resili mitig sourc instabl,-0.133333333,0.3
altern develop program south west reduc econom depend farah nimroz uruzgan helmand provinc opium product process trade help commun identifi seiz meaning opportun reduc vulner improv incom creat last job licit economi reinforc econom institut infrastructur opportun depend increas poppi cultiv farah provinc rel provinc unit nation offic drug crime unodc record year project activ focu program hop transform result farmer rural women poppi grow provinc district afghanistan benefit increas sustain incom licit crop villag base product afghan engag suppli input rural commun purchas ship process market product profit improv techniqu technolog infrastructur place help program,-0.2,0.266666667
project anticorrupt compon focu ensur billion dollar send help indonesia recov effect tsunami fulli account ensur reconstruct project proceed futur project anticorrupt compon focu ensur billion dollar send help indonesia recov effect tsunami fulli account ensur reconstruct project succeed futur project provid support satuan anti korupsi anti corrupt unit creat badan rehabilitasi rekonstruksi agenc rehabilit reconstruct,-0.5,1
altern develop program southern region counter narcot strategi helmand kandahar uruzgan provinc plan rehabilit kilomet gravel compact farm market road build kilomet cobbleston road complet kilomet irrig canal improv hectar farmland rebuild lashkar electr station improv electr access famili busi establish veterinari field unit commerci fee distribut anim fee farmer improv veget seed farmer provid technic train extens worker para vet farmer associ,0,0
afghanistan media develop empower project amdep continu strateg focu improv news develop relat radio inform underserv group rural famili women young peopl amdep support comprehens valu chain approach strengthen media sector deal train journalist establish oper network rural radio station introduc media enabl amateur voic commun social econom develop issu encourag advocaci protect journalist freedom help citizen understand valu import media inform news train media lawyer support media law polici support develop dynam independ media industri,-0.023333333,0.143333333
econom growth govern initi eggi afghanistan support public fiscal financi manag area econom fiscal polici support revenu polici program budget reform provinci budget reform provinci administr revenu reconcili databas women govern,0,0.066666667
district develop program repres umbrella approach ensur reach afghan central govern extend district countri partnership independ director local govern ministri financ provid support budget plan execut district level improv deliveri servic fund stream provid budget partial salari support hazard oper mainten fund district offici offic sector administr health justic agricultur educ afghan budgetari fund stream align tradit develop afghan govern program provid servic priorit district offici commun repres fund stream financ small scale district govern infrastructur relat servic deliveri,-0.0875,0.2375
learn commun empower program phase lcep integr commun level literaci product skill save lend initi main goal program social econom empower,0.1,0.2
project launch provid institut capac develop advocaci support women focu afghan civil societi organ cso grant order improv gender equal specif help women secur opportun advoc project goal improv statu qualiti life afghan women girl strengthen capac women focu cso contribut social econom polit develop women flexibl grant address emerg local afghan women group need empow expand activ,0.011111111,0.105555556
afghanistan social outreach program asop design work close provinci district governor strengthen commun collabor govern local commun foundat perman democrat author capac subnat level asop aim facilit creation district level council mobil commun support attempt reduc conflict promot develop encourag effici transpar use district resourc district level council identifi concern need commun establish channel commun coordin govern agenc,0.016666667,0.033333333
agricultur credit enhanc program focu enabl commerci farmer hectar access financi servic concomit posit effect term technolog adopt increas product profit object program facilit rapid disburs loan agricultur valu chain build capac financi intermediari deliv agricultur credit farmer contribut develop high valu agricultur sector build confid govern legitimaci contribut social stabil,0.096666667,0.303333333
project aim structur implement legisl fiscal regulatori institut framework reform polici formul foster transpar invest friendli economi technic assist design assist afghanistan govern creat enabl polici regulatori environ trade invest regim strengthen privat sector build institut capac afghan govern,0,0
plan local govern project plgp project provid support govern albania local govern implement legisl polici reform aim improv effici transpar account local govern oper improv local govern manag oversight select public util provid servic accord standard strengthen capabl local govern plan manag urban region growth,0,0.008333333
assess corrupt afghanistan commiss provid strategi program option recommend need opportun strengthen capac polit govern afghanistan order fulfil nation anti corrupt strategi report assess issu corrupt countri legal institut framework combat corrupt donor activ corrupt includ monitor mechan report conclud recommend object anti corrupt assist strategi guid action focu agenda assist govern civil societi help counter corrupt afghanistan,-0.355555556,0.811111111
assess polit parti program team polit parti associ stakehold implement kabul team travel herat mazar sharif meet polit parti stakehold away kabul add scope research compar inform diversifi expect away rel advanc situat capit larg assess examin program afghanistan conduct evalu success emphasi place futur direct,0.2,0.2
municip govern strateg framework municip islam republ afghanistan report focu municip level govern recogn municip broader nation govern need address need develop nation level recogn major polici document iroa includ afghanistan compact afghanistan nation develop strategi support effort govern creat independ director local govern idlg august undertak develop polici legal framework implement capac build program improv public administr capac level nation govern,0.065625,0.191666667
afghanistan elector reform civic advocaci project aerca seek facilit afghan elector reform process strengthen afghan democraci foster innov govern elector reform,0,0
elector institut afghanistan support technic financi assist larg scale train session poll count conduct larg scale civic voter educ program face face civic educ session organ women provinc reach million particip principl democraci civil right rule govern structur particip women elect administr voter candid encourag roundtabl session interact workshop provinci educ campaign final softwar provid computer map poll station analyz number voter poll station track movement elect materi countri support commun secur effort,0.497142857,0.827142857
enabl equit health reform albania eehr aim support albania progress health reform agenda strengthen govern issu health care sector allow hospit respond citizen need qualiti health care deliveri immedi object project help ministri health albanian health institut narrow health reform agenda feasibl prioriti action like greatest impact nation design implement action plan tool mechan provid evid better perform design test sit prepar guidelin broader nation implement test reform intervent project call produc tool approach address lack transpar account,0.3,0.42
local govern program albania lgpa work municip albania foster local econom growth improv local govern strengthen civic privat sector engag local develop lgpa encourag facilit local econom growth target municip increas invest creat job rais incom ultim expand municip base lgpa provid technic assist train staff target municip varieti govern issu includ collect asset manag budget procur servic provis improv manag effici creat busi friendli invest climat,-0.133333333,0.166666667
millennium challeng corpor albania threshold program stage mcca design strengthen rule reduc corrupt increas public oversight albania govern program inform technolog solut technic legal assist,-0.1,0.422222222
rule program rolp design promot better function oversight institut account court target institut societ intervent rolp task promot effici transpar account select court implement packag reform support rigor civic media monitor progress court modern improv task build capac high inspector declar audit asset hidaa select oversight institut improv check balanc oversight audit mechan branch govern,0.286666667,0.446666667
object star project support implement vietnam vietnam element access protocol relat bilater agreement support overal implement modern legal judici administr system develop vietnam institut human resourc capac implement develop recommend mitig advers effect global vulner sector popul,0.1,0.15
support albania millennium challeng account threshold agreement mcca design reduc corrupt reform public procur administr busi registr govern approach improv transpar effici servic,-0.25,0.533333333
rule program design improv uphold rule albania larg address corrupt program focu area judici perform popular mobil,0.05,0.95
purpos increas account municip govern commun serv achiev broad commun particip decis make oversight local public invest goal work select municip origin increas capac commun municip administr better articul need jointli plan develop municip expect work lead account participatori transpar govern expect intervent outcom contribut nation strategi municip develop,0.140625,0.219791667
assist network advocaci assist center project develop support exist nation advocaci assist center aac network initi establish usaid mobil action corrupt maac project project help address corrupt relat complaint citizen victim corrupt build local institut capac address corrupt network aac oper armenian young lawyer associ armavir develop center gegharkunik chamber commerc industri,-0.20625,0.420833333
assess administr legal bosnia herzegovina commiss determin administr legal function bosnia herzegovina undertak assess team ask provid technic assist program option improv legal framework administr institut improv facilit better complianc administr standard procedur countri team ask address problem backlog util case entiti court system file enforc payment primarili water heat bill individu busi,0.22,0.22
civil societi local govern support program cslgp aim increas level inform organ civic activ local nation level participatori decentr effici account local govern lead democrat societi project provid technic assist capac build local govern civic group engag participatori decis make foster construct particip cso polici make monitor empow local author embrac reform,0,0
access inform commun involv program focu train public offici local govern repres civic group freedom inform program conduct media outreach inform updat public govern issu armenia maintain freedom inform websit work improv mechan proactiv public govern hold inform provid free legal counsel citizen commun organ,0.1,0.2
mobil action corrupt armenia project maac design provid technic assist equip armenian peopl govern enhanc knowledg tool effect combat corrupt maac provid capac build assist govern agenc civil societi actor ngo coordin activ compon establish mechan address grievanc effect system level procedur reform design implement anti corrupt initi target govern agenc provid grant civil societi organ develop innov approach combat corrupt increas awar youth adult corrupt,-0.328571429,0.771428571
object anti corrupt advocaci legal advic center alac project provid citizen mean activ involv fight corrupt societi assist advic victim wit corrupt alac support project baku ganja guba main pillar project includ legal advic educ inform advocaci capac build public outreach mobil train seminar,-0.142083333,0.46375
parliamentari program azerbaijan task enhanc overal effect parliament greater procedur legisl transpar strengthen parliamentari capac effect constitu relat program aim build capac member parliament assist parliamentari staff assist establish constitu offic help establish transpar mechan legislatur enhanc capac parliament effect address civil societi concern,0.5,0.5
trade invest reform support program tirsp design help broaden sustain benefit econom growth simultan support develop transpar regulatori regim consist usaid core rule object remov critic polici regulatori administr barrier inhibit competit distort invest flow constrain trade limit progress econom integr tirsp task facilit access build capac compli core oblig commit promot develop trade invest enabl environ support streamlin transact cost relat busi establish oper support improv public infrastructur invest decis strengthen investor protect encourag major increas volum effici relat invest local foreign sourc,-0.015625,0.172916667
usaid azerbaijan partner council europ implement project collabor govern azerbaijan help prevent control occurr corrupt accord european intern standard year project design improv azerbaijan strateg anti corrupt framework improv domest legisl benchmark intern standard fight corrupt increas capac effici implement relev legisl framework establish network prevent financi money launder terror financ purpos enhanc govern capac prevent corrupt micro studi effici manag ethic provis conflict public servic,-0.25,0.508333333
purpos public expenditur reform support program azerbaijan promot adopt comprehens implement expenditur plan administr reform order significantli improv ration transpar capit budget medium term expenditur plan process aim improv transpar cost effici character budgetari approv track process promot complianc core anticorrupt econom competit social equiti develop goal govern azerbaijan improv sustain critic expenditur program growth path azerbaijan economi,0.016666667,0.066666667
project work govern citizen media public offici elect repres foster partnership provid incent anticorrupt reform,0.4,0.483333333
bangladesh democrat particip reform project work bangladeshi polit parti individu women youth help bridg commun parti constitu program design enhanc grassroot particip focu women youth improv parti access inform improv environ respons polit,0,0
goal strengthen democrat local govern bangladesh sdlg program improv transpar participatori public administr nation level enhanc legal polici reform nation level order promot expand project period project aim improv capac select local govern unit bangladesh includ union upazila parishad municip better respond need constitu,0.14,0.153333333
project seek increas confid democrat institut process bolivia promot region develop strengthen civil societi improv transpar function bolivia congress,0,0
object municip strengthen activ bolivia improv qualiti life bolivian support municip govern basic servic project work develop local capac task plan implement basic servic urban rural infrastructur project object improv municip govern manag servic deliveri perform particular attent increas account respons increas citizen particip local govern particular attent priorit commun need strengthen citizen oversight local govern oper implement municip servic infrastructur project manual labor kind contribut beneficiari promot sens greater citizen ownership,0.13030303,0.210606061
account project establish systemat sustain approach success combat corrupt long term work augment exist anticorrupt initi creat coordin comprehens publicli recogn civic anticorrupt campaign encourag ngo form larger inclus movement establish umbrella network ngo relev stakehold develop adopt enforc exist anti corrupt legisl polici creat avenu report corrupt avail mean public outreach rais awar grassroot level,-0.1953125,0.581770833
object open govern initi bulgaria improv account mechan bulgarian public administr support develop system intern control enhanc qualiti suprem audit streamlin public procur goal activ assist govern bulgaria strengthen govern audit compris intern control suprem audit correspond parliamentari oversight follow action second goal strengthen bulgaria public procur provid continu assist sector corrupt risk high program aim ultim elimin condit corrupt result poor intern control scarc manag,-0.114,0.394
object jsdp build effect credibl justic institut enabl access european union strengthen independ account effect judiciari support better coordin unifi justic bolster public confid rule project support ngo advoc independ account judiciari,0.166666667,0.188888889
object govern account project improv capac municip bosnia herzegovina provid better servic citizen increas transpar respons decis make effect manag human capit resourc support polici fiscal framework conduc account local govern,0.166666667,0.2
primari goal judici sector develop project jsdp improv effici fair justic bosnia herzegovina implement cross cut compon includ strengthen institut capac perform high judici prosecutori council hjpc improv court administr reduc case backlog court strengthen institut capac perform state ministri justic particularli legisl draft skill improv indig crimin defens servic creat nation level legal offic provid servic,0.265,0.41
govern account project design build capac critic mass municip repres thirti percent total number better serv citizen polici fiscal framework good govern aim provid local govern target technic assist improv custom servic profil administr manag system includ establish citizen servic center increas level transpar inform flow local govern depart citizen busi expand municip control revenu expenditur improv human resourc manag,0.157142857,0.292857143
program aim strengthen rule respect human right increas transpar access judici,0.142857143,0.317857143
burundi polici reform program aim strengthen relat govern civil societi media order promot dialogu foster transpar participatori land polici formul process train conflict manag anti corrupt advocaci project build capac govern civil societi media understand discuss polici matter inform inclus manner,-0.5,1
purpos post conflict transit assist program pctap burundi increas capac newli elect govern offici provinc commun collin level govern effect transpar manner promot construct relationship elect govern offici civil societi improv understand respect role increas capac nation govern civil societi plan implement nation level polici build capac area critic success post conflict transit increas civil societi capac promot peac reconcili,0.633333333,0.6
goal ctip program improv abil cambodian institut combat traffic person project seek strengthen royal govern cambodia abil coordin develop polici regul enforc mechan combat traffic person improv enforc capac combat traffic person develop coordin standard train counter traffic person project aim improv victim support servic improv enforc capac combat crime promot effect prevent particularli potenti victim traffic labor exploit collect data share inform,-0.05,0.033333333
strengthen govern account project includ compon local administr reform laar program mainstream anti corrupt equiti program laar program focu primarili commun council commun level civil societi group enhanc local democraci implic local develop laar program build linkag citizen local govern nation govern increas public particip commun plan concentr process democrat good govern principl practic local administr program seek work multipl level curb corrupt cambodia improv knowledg awar corrupt issu develop skill resourc counter corrupt effect behavior chang increas demand chang legal framework cambodia support transpar account anti corrupt practic,-0.123076923,0.451282051
